{
  "account_profile_id": "claude-subscription",
  "build_manifest_sha256": "dddddddddddddddddddddddddddddddddddddddddddddddddddddddddddddddd",
  "cache_continuity_claim": "NOT_GUARANTEED",
  "contract_bundle_digest": "cccccccccccccccccccccccccccccccccccccccccccccccccccccccccccccccc",
  "created_at": "2026-08-08T00:00:00Z",
  "generation": 1,
  "handle_digest": "3a81515c5f2c6ae7f303b38926f9ec33737b5e5e9a773360e444d37338824d6e",
  "handle_id": "ch-example-1",
  "host_observation": {},
  "identity_digest": "1388352279704490c81d678837100fcdb137507127ea817965e2b5b50d9598e1",
  "model": "sonnet",
  "policy_digest": "bbbbbbbbbbbbbbbbbbbbbbbbbbbbbbbbbbbbbbbbbbbbbbbbbbbbbbbbbbbbbbbb",
  "predecessor_handle_digest": null,
  "predecessor_handle_id": null,
  "provider_conversation_id": null,
  "provider_id": "claude_code",
  "provider_profile_id": "mlgo-claude-subscription-task-lead-sonnet",
  "provider_session_id": null,
  "reasoning_effort": "medium",
  "registry_digest": "aaaaaaaaaaaaaaaaaaaaaaaaaaaaaaaaaaaaaaaaaaaaaaaaaaaaaaaaaaaaaaaa",
  "resume_qualification": null,
  "role_id": "tech_lead",
  "run_id": "run-example",
  "runtime_version": "0.4.0-slice2-vnext",
  "schema_version": "1.0",
  "session_continuity_claim": "NONE_NEW_GENERATION",
  "task_id": "task-example",
  "terminal_id": null,
  "transport_id": "cao-main",
  "work_package_id": "bt-example"
}
